{
  "$schema": "http://json-schema.org/draft-07/schema#",
  "$id": "episode_brief.schema.json",
  "title": "EpisodeBrief",
  "description": "The seed spec for one episode. Created by the CLI at episode init time; consumed by Agent A.",
  "type": "object",
  "required": ["channel_id", "language", "topic", "quirk", "target_audience"],
  "additionalProperties": false,
  "properties": {
    "episode_id": {
      "type": "string",
      "description": "Unique slug for the episode folder, e.g. ForeignCarsTH_cadillac-cimarron"
    },
    "channel_id": {
      "type": "string",
      "description": "Identifier of the channel this episode belongs to, e.g. ForeignCarsTH"
    },
    "language": {
      "type": "string",
      "description": "BCP-47-ish language code or name for narration, e.g. th, en"
    },
    "topic": {
      "type": "string",
      "description": "The subject of the episode, e.g. Cadillac Cimarron"
    },
    "quirk": {
      "type": "string",
      "description": "The specific angle/hook that makes this episode interesting"
    },
    "target_audience": {
      "type": "string",
      "description": "Who this episode is made for, e.g. car enthusiasts, general audience"
    },
    "created_at": {
      "type": "string",
      "format": "date-time"
    },
    "status": {
      "type": "string",
      "enum": ["draft", "ready_for_producer"],
      "default": "draft"
    }
  }
}
