{
  "episode_id": "ForeignCarsTH_cadillac-cimarron",
  "channel_id": "ForeignCarsTH",
  "language": "th",
  "topic": "Cadillac Cimarron",
  "quirk": "Cadillac's infamous attempt to turn the GM J-car into a luxury compact",
  "target_audience": "Thai car enthusiasts interested in obscure foreign automotive history",
  "created_at": "2026-08-28T06:08:05.666252+00:00",
  "status": "draft"
}
